<?xml version="1.0" encoding="UTF-8"?>
<xs:schema xmlns:xs="http://www.w3.org/2001/XMLSchema">

    <xs:element name="bookhub">
        <xs:complexType>
            <xs:sequence>
                <xs:element name="books">
                    <xs:complexType>
                        <xs:sequence>
                            <xs:element name="book" maxOccurs="unbounded">
                                <xs:complexType>
                                    <xs:sequence>
                                        <xs:element name="title" type="xs:string"/>
                                        <xs:element name="author" type="xs:string"/>
                                        <xs:element name="category" type="xs:string"/>
                                        <xs:element name="price" type="xs:decimal"/>
                                        <xs:element name="stock" type="xs:int"/>
                                    </xs:sequence>
                                    <xs:attribute name="id" type="xs:string" use="required"/>
                                </xs:complexType>
                            </xs:element>
                        </xs:sequence>
                    </xs:complexType>
                </xs:element>
            </xs:sequence>
        </xs:complexType>
    </xs:element>

</xs:schema>
